{
  "$schema": "../../../../docs/ai/schemas/context-schema.json",
  "layer": 3,
  "language": "typescript-jsx",
  "purpose": "App-level providers (primitives context, query client, theme)",
  "files": {
    "entry-client.tsx": {
      "export": "*",
      "type": "component",
      "desc": "Client-side hydration entry point"
    },
    "entry-server.tsx": {
      "export": "*",
      "type": "component",
      "desc": "Server-side rendering entry point"
    },
    "primitives-provider.tsx": {
      "export": "AppPrimitivesProvider",
      "type": "function",
      "desc": "Root provider wiring shadcn/ui components into PrimitivesContext"
    }
  },
  "extDeps": {
    "entry-client.tsx": [
      "@tanstack/react-start/client",
      "react",
      "react-dom/client"
    ],
    "entry-server.tsx": [
      "@tanstack/react-start/server"
    ],
    "primitives-provider.tsx": [
      "react",
      "@my-framework/core"
    ]
  }
}
