{
  "$schema": "../../../../docs/ai/schemas/context-schema.json",
  "layer": 3,
  "language": "typescript-jsx",
  "purpose": "Shared utility functions (cn helper, serialization)",
  "files": {
    "query-client.tsx": {
      "export": "AppQueryProvider",
      "type": "function",
      "desc": "TanStack Query provider wrapper for the app"
    },
    "serializable-record.ts": {
      "export": "SerializableRecord",
      "type": "type",
      "desc": "Type for JSON-serializable key-value records"
    },
    "to-serializable.ts": {
      "export": "toSerializable",
      "type": "function",
      "desc": "Converts form data to SerializableRecord format"
    },
    "utils.ts": {
      "export": "cn",
      "type": "function",
      "desc": "Tailwind class merge utility (clsx + tailwind-merge)"
    }
  },
  "extDeps": {
    "query-client.tsx": [
      "@tanstack/react-query",
      "react"
    ],
    "utils.ts": [
      "clsx",
      "tailwind-merge"
    ]
  }
}
