{
  "$schema": "../../../../docs/ai/schemas/context-schema.json",
  "layer": 3,
  "language": "typescript",
  "purpose": "Zustand state stores for demo data (users, orders, form schemas)",
  "files": {
    "selection-store.ts": {
      "export": "createSelectionStore",
      "type": "function",
      "desc": "Zustand store factory for grid row selection state"
    }
  },
  "extDeps": {
    "selection-store.ts": [
      "zustand",
      "@my-framework/core"
    ]
  }
}
