{
  "$schema": "../../../../../docs/ai/schemas/context-schema.json",
  "layer": 2,
  "language": "typescript",
  "purpose": "Zod schemas and runtime validation functions.",
  "files": {
    "evaluate-condition.ts": {
      "export": "evaluateCondition",
      "type": "function",
      "desc": "Evaluates FieldCondition"
    },
    "field-schema.ts": {
      "export": "validateFieldSchema, fieldSchemaValidator",
      "type": "const",
      "desc": "FieldSchema Zod validator"
    },
    "field-value.ts": {
      "export": "validateFieldValue",
      "type": "function",
      "desc": "Runtime field value validation"
    },
    "form-schema.ts": {
      "export": "validateFormSchema, formSchemaValidator",
      "type": "const",
      "desc": "FormSchema Zod validator"
    },
    "grid-schema.ts": {
      "export": "validateGridSchema, gridColumnSchemaValidator, gridSchemaValidator",
      "type": "const",
      "desc": "GridSchema Zod validators"
    },
    "index.ts": {
      "export": "*",
      "type": "re-export",
      "desc": "Barrel re-exports"
    },
    "shared-schemas.ts": {
      "export": "ValidationResult, fieldTypeSchema, selectOptionSchema, validationRuleSchema, fieldConditionSchema, fileUploadConfigSchema, datePickerConfigSchema, multiSelectConfigSchema, paginationConfigSchema, columnFilterConfigSchema, statusConfigSchema, serverPaginationConfigSchema, i18nConfigSchema, virtualScrollConfigSchema",
      "type": "const",
      "desc": "Shared Zod schemas"
    },
    "wizard-schema.ts": {
      "export": "validateWizardSchema, wizardSchemaValidator",
      "type": "const",
      "desc": "WizardSchema Zod validator"
    }
  },
  "rels": {
    "field-schema.ts": [
      "shared-schemas.ts"
    ],
    "form-schema.ts": [
      "field-schema.ts",
      "shared-schemas.ts"
    ],
    "grid-schema.ts": [
      "shared-schemas.ts"
    ],
    "wizard-schema.ts": [
      "form-schema.ts",
      "shared-schemas.ts"
    ]
  },
  "extDeps": {
    "evaluate-condition.ts": [
      "../types"
    ],
    "field-schema.ts": [
      "zod"
    ],
    "field-value.ts": [
      "../types"
    ],
    "form-schema.ts": [
      "zod"
    ],
    "grid-schema.ts": [
      "zod",
      "../types/branded.ts"
    ],
    "shared-schemas.ts": [
      "zod"
    ],
    "wizard-schema.ts": [
      "zod"
    ]
  }
}
