{
  "$schema": "../../../../../docs/ai/schemas/context-schema.json",
  "layer": 2,
  "language": "typescript-jsx",
  "purpose": "React renderers that consume schemas via PrimitivesContext.",
  "files": {
    "field-renderer.tsx": {
      "export": "FieldRenderer",
      "type": "function",
      "desc": "Renders form fields from schema"
    },
    "grid-column-header.tsx": {
      "export": "GridColumnHeader",
      "type": "function",
      "desc": "Column header with sorting"
    },
    "grid-pagination.tsx": {
      "export": "GridPagination",
      "type": "function",
      "desc": "Grid pagination controls"
    },
    "grid-toolbar.tsx": {
      "export": "GridToolbar",
      "type": "function",
      "desc": "Grid toolbar with filters"
    },
    "index.ts": {
      "export": "*",
      "type": "re-export",
      "desc": "Barrel re-exports"
    },
    "schema-form.tsx": {
      "export": "SchemaForm",
      "type": "function",
      "desc": "Renders form from FormSchema"
    },
    "schema-grid.tsx": {
      "export": "SchemaGrid",
      "type": "function",
      "desc": "Renders grid from GridSchema"
    },
    "schema-wizard.tsx": {
      "export": "SchemaWizard",
      "type": "function",
      "desc": "Renders multi-step wizard with API validation"
    },
    "sortable-column-header.tsx": {
      "export": "SortableColumnHeader",
      "type": "function",
      "desc": "Drag-and-drop column header wrapper using @dnd-kit/sortable"
    },
    "theme-provider.tsx": {
      "export": "ThemeProvider, ThemeContext",
      "type": "const",
      "desc": "Theme context provider"
    },
    "use-theme.ts": {
      "export": "useTheme",
      "type": "function",
      "desc": "Theme context hook"
    },
    "wizard-review-step.tsx": {
      "export": "WizardReviewStep",
      "type": "function",
      "desc": "Review step with conditional field filtering"
    }
  },
  "rels": {
    "schema-form.tsx": [
      "field-renderer.tsx"
    ],
    "schema-grid.tsx": [
      "grid-toolbar.tsx",
      "grid-pagination.tsx",
      "grid-column-header.tsx",
      "sortable-column-header.tsx"
    ],
    "schema-wizard.tsx": [
      "field-renderer.tsx",
      "wizard-review-step.tsx"
    ],
    "sortable-column-header.tsx": [
      "grid-column-header.tsx"
    ],
    "use-theme.ts": [
      "theme-provider.tsx"
    ]
  },
  "extDeps": {
    "field-renderer.tsx": [
      "../types",
      "../../primitives/address-data.ts",
      "react",
      "../context/primitives-context.tsx",
      "../helpers/default-fallback-component.tsx"
    ],
    "grid-column-header.tsx": [
      "@tanstack/react-table",
      "../types",
      "../context/primitives-context.tsx"
    ],
    "grid-pagination.tsx": [
      "@tanstack/react-table",
      "../types",
      "../context/primitives-context.tsx",
      "../helpers/i18n.ts"
    ],
    "grid-toolbar.tsx": [
      "react",
      "@tanstack/react-table",
      "../types",
      "../context/primitives-context.tsx",
      "../helpers/i18n.ts"
    ],
    "schema-form.tsx": [
      "@tanstack/react-form",
      "../types",
      "../validators",
      "../context/primitives-context.tsx",
      "../helpers/i18n.ts",
      "../helpers/is-field-visible.ts"
    ],
    "schema-grid.tsx": [
      "react",
      "@tanstack/react-table",
      "@tanstack/react-virtual",
      "@dnd-kit/core",
      "@dnd-kit/sortable",
      "../types",
      "../context/primitives-context.tsx",
      "../helpers/i18n.ts"
    ],
    "schema-wizard.tsx": [
      "react",
      "@tanstack/react-form",
      "../types",
      "../validators",
      "../helpers/is-field-visible.ts",
      "../context/primitives-context.tsx",
      "../helpers/i18n.ts"
    ],
    "sortable-column-header.tsx": [
      "@dnd-kit/sortable",
      "@tanstack/react-table",
      "../types"
    ],
    "theme-provider.tsx": [
      "react",
      "../types"
    ],
    "use-theme.ts": [
      "react",
      "../types"
    ],
    "wizard-review-step.tsx": [
      "../types",
      "../helpers/is-field-visible.ts",
      "../context/primitives-context.tsx"
    ]
  }
}
